{
  "policyArn": "arn:aws:iot:us-east-1:123456789012:thing/example",
  "policyName": "example-resource",
  "policyDocument": "example-value",
  "policyVersionId": "id-abc123",
  "isDefaultVersion": "example-value",
  "creationDate": "example-value",
  "lastModifiedDate": "example-value",
  "generationId": "id-abc123"
}